{
  "spec_version": "0.4",
  "title": "EMPSL Glyph Grammar Rule Catalog",
  "rule_count": 30,
  "rules": [
    {
      "id": "G-001",
      "domain": "glyph",
      "severity": "error",
      "title": "原子與變體必須存在",
      "description": "所有槽位 ID 必須存在於原子或種子變體註冊表。"
    },
    {
      "id": "G-002",
      "domain": "glyph",
      "severity": "error",
      "title": "種子三欄必須一致",
      "description": "seed_base、seed_transform 與 seed_variant 必須描述同一變體。"
    },
    {
      "id": "G-003",
      "domain": "glyph",
      "severity": "error",
      "title": "音系槽不得超過四個",
      "description": "六槽模型的音系區最多容納四個附標。"
    },
    {
      "id": "G-004",
      "domain": "glyph",
      "severity": "error",
      "title": "配方版本必須為 0.4",
      "description": "v0.4 合法性證書只適用於 0.4 配方。"
    },
    {
      "id": "P-001",
      "domain": "phonology",
      "severity": "error",
      "title": "音系類別不得重複",
      "description": "聲母、四呼、韻類與結構附標各最多一個，且不得重複 ID。"
    },
    {
      "id": "P-002",
      "domain": "phonology",
      "severity": "error",
      "title": "聲母與四呼必須相容",
      "description": "舌面音、舌尖音與舌根音具有不同四呼限制。"
    },
    {
      "id": "P-003",
      "domain": "phonology",
      "severity": "error",
      "title": "四呼與韻類必須相容",
      "description": "撮口呼、齊齒呼、合口呼與開口呼只接受規格表中的韻類。"
    },
    {
      "id": "P-004",
      "domain": "phonology",
      "severity": "error",
      "title": "ㄦ韻使用限制",
      "description": "RIME-ER 只允許零聲母、開口呼，且不能再加兒化附標。"
    },
    {
      "id": "P-005",
      "domain": "phonology",
      "severity": "warning",
      "title": "輕聲與弱化附標一致",
      "description": "T0 建議搭配 ST-LIGHT；ST-LIGHT 若非 T0 則為錯誤。"
    },
    {
      "id": "P-006",
      "domain": "phonology",
      "severity": "error",
      "title": "鼻尾附標必須有鼻韻",
      "description": "ST-NASAL 只可搭配 AN、EN、ANG、ENG。"
    },
    {
      "id": "P-007",
      "domain": "phonology",
      "severity": "error",
      "title": "零聲母附標必須無聲母",
      "description": "ST-ZERO 與任何 ONSET-* 不可共現。"
    },
    {
      "id": "P-008",
      "domain": "phonology",
      "severity": "error",
      "title": "邊界符號必須排他",
      "description": "ST-BOUNDARY 不得攜帶聲母、四呼或韻類，並使用 T0、PH16-00。"
    },
    {
      "id": "P-009",
      "domain": "phonology",
      "severity": "error",
      "title": "兒化不得重複編碼",
      "description": "ST-RHOTIC 不得與 RIME-ER 或 ST-NASAL 同時使用。"
    },
    {
      "id": "P-010",
      "domain": "phonology",
      "severity": "error",
      "title": "可發音詞素必須有韻類",
      "description": "非邊界詞素至少要有一個 RIME-*；四呼也不可孤立。"
    },
    {
      "id": "T-001",
      "domain": "transform",
      "severity": "error",
      "title": "變換角色必須相容",
      "description": "不同幾何變換只允許指定的 identity、allographic、semantic_modifier 或 structural 角色。"
    },
    {
      "id": "T-002",
      "domain": "transform",
      "severity": "error",
      "title": "變換與語義種類必須相容",
      "description": "開口、內嵌與交叉等變換不可任意套用到所有語義種類。"
    },
    {
      "id": "T-003",
      "domain": "transform",
      "severity": "error",
      "title": "邊界符號不得作語義變換",
      "description": "delimiter／ST-BOUNDARY 只使用原形 ID。"
    },
    {
      "id": "S-001",
      "domain": "semantics",
      "severity": "error",
      "title": "概念 ID 必須穩定",
      "description": "concept_id 採 namespace:kind:local-id 三段式。"
    },
    {
      "id": "S-002",
      "domain": "semantics",
      "severity": "error",
      "title": "語義種類與算子必須相容",
      "description": "item、operator、binder、delimiter、meta 等種類各有允許算子。"
    },
    {
      "id": "S-003",
      "domain": "semantics",
      "severity": "error",
      "title": "算子參數模式必須相符",
      "description": "固定參數與可變參數模式必須符合算子定義。"
    },
    {
      "id": "S-004",
      "domain": "semantics",
      "severity": "error",
      "title": "固定參數數量必須相符",
      "description": "fixed arity 的 inputs 長度必須等於 value。"
    },
    {
      "id": "S-005",
      "domain": "semantics",
      "severity": "error",
      "title": "語義外框與算子必須相容",
      "description": "因果、否定、時態、模態等算子只能放入對應外框。"
    },
    {
      "id": "S-006",
      "domain": "semantics",
      "severity": "warning",
      "title": "輸出型別應符合外框",
      "description": "semantic.signature.output 建議與語義外框的標準輸出型別一致。"
    },
    {
      "id": "A-001",
      "domain": "acoustics",
      "severity": "error",
      "title": "可視相位與聲學簽名一致",
      "description": "acoustic.phase_signature 必須等於字形 PH16 槽位。"
    },
    {
      "id": "A-002",
      "domain": "acoustics",
      "severity": "error",
      "title": "聲學類別必須可推導",
      "description": "voiced_harmonic、mixed、noise_dominant、silent 應由音節結構推導。"
    },
    {
      "id": "A-003",
      "domain": "acoustics",
      "severity": "error",
      "title": "靜音物件不得攜帶 FARHP",
      "description": "silent 必須 source=NONE、phase=PH16-00、profile_id=null。"
    },
    {
      "id": "A-004",
      "domain": "acoustics",
      "severity": "error",
      "title": "有聲物件必須指定 FARHP 來源",
      "description": "非 silent 物件不可使用 NONE，且必須有 profile_id。"
    },
    {
      "id": "A-005",
      "domain": "acoustics",
      "severity": "warning",
      "title": "噪聲主導音的相位只是弱控制量",
      "description": "noise_dominant 使用非零 PH16 時只視為近似標記。"
    },
    {
      "id": "A-006",
      "domain": "acoustics",
      "severity": "warning",
      "title": "FARHP-G 需要可逆濾波語境",
      "description": "FARHP-G 用於聲門估計；噪聲主導或無韻核時可靠度較低。"
    },
    {
      "id": "A-007",
      "domain": "acoustics",
      "severity": "warning",
      "title": "低信心度相位不得作硬判定",
      "description": "非靜音物件若 confidence < 0.5，只可作近似聲學標記。"
    }
  ],
  "ruleset_sha256": "84fecd66f230f4c52fd125e45a4164c96c7afc8fad5c6f40fa47c9f67f3cb689"
}